{
 "schema": 2,
 "writer": "page",
 "at": "2026-10-20T14:00:00Z",
 "source": "E.V. Home",
 "date": "2026-10-20",
 "messages": {
  "m-20261020-140000000-matt": {
   "role": "matt",
   "text": "A made-up question",
   "at": "2026-10-20T14:00:00Z"
  },
  "m-20261020-140001000-ev": {
   "role": "ev",
   "text": "A made-up answer",
   "at": "2026-10-20T14:00:01Z",
   "replyTo": "m-20261020-140000000-matt",
   "tier": "local"
  }
 }
}
